trend,link,top
Shakira - Acróstico (Official Video),https://www.youtube.com/watch?v=PWmJhh_qTSY,1
PEOPLE LA TRINI ME HIZO UN SIN EDITAR DÍA DE LA MAMÁ!! 😂😂😂,https://www.youtube.com/watch?v=m-KvMYcAsnU,2
Karol G: Tiny Desk Concert,https://www.youtube.com/watch?v=D8UWsFMVj_Q,3
Builder Base 2.0 Is Here! Clash of Clans Official,https://www.youtube.com/watch?v=96TCZDtzfOM,4
(여자)아이들((G)I-DLE) - '퀸카 (Queencard)' Official Music Video,https://www.youtube.com/watch?v=7HDeem-JaSY,5
EL ANIMATRONICO QUE CAMBIA TODA LA CRONOLOGIA DE FIVE NIGHTS AT FREDDY´S,https://www.youtube.com/watch?v=2SBaeqdPz6U,6
Superando mi MAYOR miedo,https://www.youtube.com/watch?v=vOGvHB_Nw7c,7
TOM CROWLEY VS EL MENOR I PLAY OFF I #FMSCHILE 2022 I URBAN ROOSTERS,https://www.youtube.com/watch?v=ZaS0Oyqg2Ns,8
Hice Trampas en Batalla de Construcción de Coach Pickles!,https://www.youtube.com/watch?v=xAd8TLrjIDs,9
TRES ESTRELLAS en los DESAFÍOS VENTAJOSOS de la ALDEA NOCTURNA 2.0 ⭐ Actualización de Clash of Clans,https://www.youtube.com/watch?v=AGoAalRRgRM,10
CAPTURÉ UN EVIL BANBAN,https://www.youtube.com/watch?v=VySveudBgvA,11
El secreto para tener cientos de limones en casa y en maceta ya no necesitas comprar limones,https://www.youtube.com/watch?v=7qG9KXhiq5w,12
REDFALL y los juegos AAA DESASTROSOS,https://www.youtube.com/watch?v=UKCuDFG3cSo,13
"Stray Kids ＜★★★★★ (5-STAR)＞ UNVEIL : TRACK 3 ""죽어보자 (GET LIT)""",https://www.youtube.com/watch?v=Ce4OElNzXbo,14
Mama - Neutro Shorty x Chucky73 (Video Oficial),https://www.youtube.com/watch?v=ymE0a6LyN4A,15
JUGAMOS al FOOTBALL TIC TAC TOE ¿Quién lo Resolverá?,https://www.youtube.com/watch?v=y7ECmyQ4OSc,16
Final Highlights Tapia/Coello Vs Galán/Lebrón Estrella Damm Vigo Open 2023,https://www.youtube.com/watch?v=pi0YEKGgEB8,17
NUESTRA NUEVA CASA! 😱 HOUSE TOUR,https://www.youtube.com/watch?v=nKzrmV8rH4I,18
ViruZz y su impresionante KO contra DK Money: ¡Qué absoluta locura de gancho!,https://www.youtube.com/watch?v=Bf4rp6_RKUA,19
Shakira - Acróstico (Solo Version - Official Lyric Video),https://www.youtube.com/watch?v=ToQ5jVj1Ppo,20
#LaJunta | Entrevista a AK4:20 & MARCIANEKE “EL RETORNO DE LA AMISTAD“,https://www.youtube.com/watch?v=8IE6n6naJuY,21
LAS 24 HORAS MAS RARAS DE MI VIDA! 😱 ISLA sin Autos 😅 RETO EXTREMO en Trawangan 🔥 Sandra Cires Art,https://www.youtube.com/watch?v=mUNRkATJzXI,22
Garten of Banban es una Pesadilla en Spore,https://www.youtube.com/watch?v=9COocVOJvaA,23
@ITHANNY ft @JereKlein - MILLONARIOS JUNTOS | Prod. Mateo on the Beatz,https://www.youtube.com/watch?v=P2TDkf4V_JU,24
Jukilop controla mi vida por un día (Salí a la calle en t4ng4) 🔥 Cecia loaiza,https://www.youtube.com/watch?v=yLZr7uM0gSk,25
100 BOTONES MISTERIOSOS Y UNO TE HACE CAER !!!,https://www.youtube.com/watch?v=eYu4Pzdj4hY,26
La evolución de Super Mario (ANIMADA),https://www.youtube.com/watch?v=4XQfGKc6GGU,27
PELEANDO TODO EL DÍA FRENTE A TODOS 🤯 Jukilop | Kimberly Loaiza,https://www.youtube.com/watch?v=ZwtBTpy7JLA,28
PINTÉ LA PARED DE FEDE VIGEVANI EN SU NUEVA CASA 🏠,https://www.youtube.com/watch?v=x_lHfP_SfuU,29
Level Up With Builder Hall 10! Clash of Clans New Update,https://www.youtube.com/watch?v=udt9VsIpSv8,30
BABYMONSTER - 'DREAM' (PRE-DEBUT SONG),https://www.youtube.com/watch?v=ynOtYmpZxak,31
"Kidd Voodoo, Young Cister - Fashion Girl (Remix) (Video Oficial)",https://www.youtube.com/watch?v=_fzoBILLZGY,32
NACIMIENTO DE CESAR ARTURO👶🏻 El mejor día de nuestras vidas 🥰| Carol Castro ❤️,https://www.youtube.com/watch?v=yqeIMz2v8WY,33
ME ENCUENTRO CON CHARLY SINEWAN EN COLOMBIA😂🙌 | BOGOTA🇨🇴,https://www.youtube.com/watch?v=4IZyQgYSlNk,34
"Eladio Carrión - Quizás, Tal Vez (Live Session) | Vevo ctrl",https://www.youtube.com/watch?v=_7N_vPHvcno,35
"Yailin La Mas Viral, Shadow Blow - Solo Tú y Yo (Video Oficial)",https://www.youtube.com/watch?v=q49UW_RSr3c,36
CONSTRUÍ UNA BASE SECRETA y Mi Amigo No lo Sabe 😂 🏝️ VICNIX ISLA DESIERTA #4,https://www.youtube.com/watch?v=WdLgqP5wj-g,37
Underdog - Antes de La Velada Del Año 3,https://www.youtube.com/watch?v=SB29Ps5DUJs,38
"Si, Si Eres Tu",https://www.youtube.com/watch?v=SnRczXoSgsc,39
SHAKIRA vuelve a IMPACTAR con ACRÓSTICO | VOCAL COACH reaction & analysis,https://www.youtube.com/watch?v=NCD3TQlFw_Y,40
Don Omar x Cosculluela - Bandidos [Official Gaming Video],https://www.youtube.com/watch?v=n6-lcXyH9zA,41
¡APLASTANTE GOLEADA PARISINA CON SABOR A TÍTULO EN EL REGRESO DE MESSI! | PSG 5-0 Ajaccio | RESUMEN,https://www.youtube.com/watch?v=zuvI06ORKrI,42
ESTO ES LO QUE COMPRAMOS EN ALIEXPRESS,https://www.youtube.com/watch?v=SEH6g1-5hDo,43
Esto pasara en Garten Of Banban 4...,https://www.youtube.com/watch?v=603irMfjEZU,44
Probé Los PEORES JUEGOS de CELULAR 3 🤮,https://www.youtube.com/watch?v=bJZi_o8JESY,45
"Sebastián Yatra, Manuel Turizo, Beéle - VAGABUNDO (Official Video)",https://www.youtube.com/watch?v=0J1hIERZ1yA,46
Eladio Carrión - Cuevita (Live Session) | Vevo ctrl,https://www.youtube.com/watch?v=Hiy-ipcS_U8,47
😳 24 HORAS SIN FILTROS: UN DÍA REAL EN LA VIDA DE LULU99❗,https://www.youtube.com/watch?v=r0rjwsn4AHc,48
Katteyes - jukiada (Official Music Video),https://www.youtube.com/watch?v=TSZuMdm-E3k,49
Mi experiencia con los BACKROOMS en MINECRAFT,https://www.youtube.com/watch?v=e6AVxp_2lQU,50
"Anuel AA, Dj Luian, Mambo Kingz - Mejor Que Yo (Video Oficial)",https://www.youtube.com/watch?v=VmRUE1A_Idw,51
"Jairo Vera, Juanka - Madrid (Video Oficial)",https://www.youtube.com/watch?v=mdDnOT4_IzE,52
"FLOTAO REMIX - Sayian Jimmy, Endo, Yishark, Pablo, Jairo, Nicko, Jamby, Punto40, Balbi, Marcianeke",https://www.youtube.com/watch?v=YA4LIb-IImE,53
Shakira - Acróstico (Official Video),https://www.youtube.com/watch?v=PWmJhh_qTSY,54
"Kidd Voodoo, Young Cister - Fashion Girl (Remix) (Video Oficial)",https://www.youtube.com/watch?v=_fzoBILLZGY,55
PEOPLE LA TRINI ME HIZO UN SIN EDITAR DÍA DE LA MAMÁ!! 😂😂😂,https://www.youtube.com/watch?v=m-KvMYcAsnU,56
"Yailin La Mas Viral, Shadow Blow - Solo Tú y Yo (Video Oficial)",https://www.youtube.com/watch?v=q49UW_RSr3c,57
Chencho Corleone - Un Cigarrillo (Official Video),https://www.youtube.com/watch?v=NKJXmhI7prc,58
Tego Calderón - La Receta (Official Video),https://www.youtube.com/watch?v=LGRxyz2W2Og,59
Prueba de obediencia para KIMA & JUANITO 😳 Jukilop | Kimberly Loaiza,https://www.youtube.com/watch?v=O1tSvHLJWWc,60
Yahritza Y Su Esencia & Grupo Frontera - Frágil (Official Lyric Video),https://www.youtube.com/watch?v=MtPgcgcZZEc,61
Como tener el MEJOR CAMPAMENTO DEL MUNDO!,https://www.youtube.com/watch?v=Ymaw69ie33o,62
TOM CROWLEY VS EL MENOR I PLAY OFF I #FMSCHILE 2022 I URBAN ROOSTERS,https://www.youtube.com/watch?v=ZaS0Oyqg2Ns,63
Bellakita - El Jordan 23 [Prod By BigCvyu] (Official Video),https://www.youtube.com/watch?v=jU9mhERk9jc,64
MADRID,https://www.youtube.com/watch?v=UV0v2OvzPy8,65
CONDUZCO MI TESLA MODEL S PLAID POR PRIMERA VEZ - TheGrefg,https://www.youtube.com/watch?v=DbQeba4DLD8,66
Don Omar x Cosculluela - Bandidos [Official Gaming Video],https://www.youtube.com/watch?v=n6-lcXyH9zA,67
¡IMPOSIBLE SALIR de la GUARDERIA ABANDONADA! 😱🧸💀 SILVIOGAMER en GARTEN of BANBAN 3 🌈,https://www.youtube.com/watch?v=3BrrJ6ljfkI,68
"Sebastián Yatra, Manuel Turizo, Beéle - VAGABUNDO (Official Video)",https://www.youtube.com/watch?v=0J1hIERZ1yA,69
PINTÉ LA PARED DE FEDE VIGEVANI EN SU NUEVA CASA 🏠,https://www.youtube.com/watch?v=x_lHfP_SfuU,70
PIMPINELA | LLORO,https://www.youtube.com/watch?v=VPEe1IJSe6w,71
NACIMIENTO DE CESAR ARTURO👶🏻 El mejor día de nuestras vidas 🥰| Carol Castro ❤️,https://www.youtube.com/watch?v=yqeIMz2v8WY,72
La ley de Baltazar / Mejores Momentos / Capítulo Final,https://www.youtube.com/watch?v=_MLsHJGL31c,73
Katteyes - jukiada (Official Music Video),https://www.youtube.com/watch?v=TSZuMdm-E3k,74
Mi experiencia con los BACKROOMS en MINECRAFT,https://www.youtube.com/watch?v=e6AVxp_2lQU,75
Myke Towers & J Balvin - Celos (Video Oficial),https://www.youtube.com/watch?v=ga24VfMGnCY,76
Américo & Paola Jara - Cuéntaselo (Video Oficial),https://www.youtube.com/watch?v=AyBciG0LzOI,77
Grupo Zúmbale Primo & Alanys Lagos - Basta Ya (Video Oficial),https://www.youtube.com/watch?v=x9MeRTE-hro,78
(여자)아이들((G)I-DLE) - 'Allergy' Official Music Video,https://www.youtube.com/watch?v=XZaBkbvteBc,79
ViruZz y su impresionante KO contra DK Money: ¡Qué absoluta locura de gancho!,https://www.youtube.com/watch?v=Bf4rp6_RKUA,80
NUESTRA NUEVA CASA! 😱 HOUSE TOUR,https://www.youtube.com/watch?v=nKzrmV8rH4I,81
"Eladio Carrión - Quizás, Tal Vez (Live Session) | Vevo ctrl",https://www.youtube.com/watch?v=_7N_vPHvcno,82
PELEANDO TODO EL DÍA FRENTE A TODOS 🤯 Jukilop | Kimberly Loaiza,https://www.youtube.com/watch?v=ZwtBTpy7JLA,83
Grupo Frontera x Bad Bunny - un x100to (Video Oficial),https://www.youtube.com/watch?v=3inw26U-os4,84
"José Luis Repenning y su hija mayor se lucen cantando juntos. Tu Día, Canal 13.",https://www.youtube.com/watch?v=AfHruMcZFHM,85
COLOREA O MUERE MOMENTOS DIVERTIDOS (ROBLOX),https://www.youtube.com/watch?v=d0he6bgroKI,86
MAIYE ESTÁ EMBARAZADA 🤰🏻😳// FAMILIA RECOCHA,https://www.youtube.com/watch?v=K80eCTpadWQ,87
The confusing issue of money in Argentina | IS A DOLLAR WORTH GOLD? 💵🇦🇷,https://www.youtube.com/watch?v=kiC1rPh1C3U,88
PENALTIS DE LA VERDAD ⚽🔥 con LA ÉLITE,https://www.youtube.com/watch?v=lzNkbq-JvTM,89
I Went Alone to the most Paranormal Island in the World,https://www.youtube.com/watch?v=ZwXeOAcFp8c,90
EL ÚLTIMO de LA ÉLITE en FALLAR UN PENALTI GANA 1000€,https://www.youtube.com/watch?v=IysXTdNWOOk,91
"Life in a ""dangerous"" neighborhood in Argentina : FUERTE APACHE 🇦🇷",https://www.youtube.com/watch?v=cqisQbPgimc,92
Superando mi MAYOR miedo,https://www.youtube.com/watch?v=vOGvHB_Nw7c,93
Daft Punk - Infinity Repeating (2013 Demo) (feat. Julian Casablancas+The Voidz),https://www.youtube.com/watch?v=imBlPXbAv6E,94
Jukilop controla mi vida por un día (Salí a la calle en t4ng4) 🔥 Cecia loaiza,https://www.youtube.com/watch?v=yLZr7uM0gSk,95
¡CUIDADO con el TREN en GTA 5! 🚆😂 Los COMPAS,https://www.youtube.com/watch?v=Cesk55LEF0o,96
EL ANIMATRONICO QUE CAMBIA TODA LA CRONOLOGIA DE FIVE NIGHTS AT FREDDY´S,https://www.youtube.com/watch?v=2SBaeqdPz6U,97
